{
  "version": "1.0",
  "agent_role": "worker",
  "axis": "Sort projects and build home structure",
  "decision": "Generate 3 organization options + a unique next step.",
  "constraints": [
    "no psychology",
    "no empathy",
    "no stories",
    "max 3 options"
  ],
  "options": [
    {
      "id": "A",
      "title": "Structure by domains",
      "steps": [
        "Extract tags from repos and documents",
        "Group into 6-10 categories",
        "Generate homepage with sections"
      ],
      "risk": "low",
      "requires_user_approval": true
    },
    {
      "id": "B",
      "title": "Structure by products (pipeline)",
      "steps": [
        "Identify input->process->output for each project",
        "Build relational graph",
        "Generate homepage + dependency map"
      ],
      "risk": "medium",
      "requires_user_approval": true
    }
  ],
  "next_action": {
    "owner": "user",
    "action": "Choose option A or B.",
    "deadline": "now"
  },
  "output": {
    "format": "markdown",
    "content": "## Axis\nSort projects and build home structure\n\n## Options\n- A: Structure by domains\n- B: Structure by products (pipeline)\n\n## Next\nChoose A or B."
  },
  "meta": {
    "created_at": "2026-02-01T05:00:00Z",
    "language": "ro",
    "style_flags": {
      "no_psychology": true,
      "no_empathy": true,
      "no_stories": true,
      "administrative": true,
      "structured": true
    }
  }
}
